{
  "kicker": "판정",
  "title": "게시는 사본이 아니다",
  "ratio": "5:5",
  "lead": "게시 링크는 원본을 그대로 비춘다",
  "bullets": [
    {
      "text": "원본이 고쳐지면 게시면도 함께 바뀐다",
      "em": true
    },
    {
      "text": "참조 복제만 스냅샷으로 굳는다"
    },
    {
      "text": "종합보고는 kind 에 따라 갈린다"
    },
    {
      "text": "편집 권한은 원본 정책을 따라간다"
    }
  ],
  "conclusion": {
    "pre": "게시는 ",
    "strong": "살아 있는 링크",
    "post": " 다"
  },
  "visual": {
    "kind": "note",
    "note": {
      "tone": "info",
      "headline": "강조 박스 표제가 두 행을 채우는 상한 표본 문장으로 여백을함",
      "lines": [
        "부연 첫 줄이 한 행 상한 표본 문장으로 여",
        "부연 둘째 줄도 같은 상한 표본 문장으로 여",
        "부연 셋째 줄 역시 상한 표본 문장으로 여백",
        "부연 넷째 줄까지 상한 표본 문장으로 여백을"
      ]
    }
  },
  "frame": {
    "brand": "ReportArchive",
    "idx": "05",
    "total": "07"
  }
}
